{
  "generated_at": "2026-09-01T12:00:00+00:00",
  "id": "python-v6-small",
  "kind": "static",
  "provenance": {
    "generator": "python/yt_discover_tests/conformance/generate_dataset.py",
    "generator_version": 6,
    "profile": "small",
    "seed": 31415926
  },
  "record_count": 60,
  "record_digest_sha256": "a69fdfe91767b18232ddd8aefd6c563c6a5c01e4300c80c56a8fdaaf760ee545",
  "records": [
    {
      "availability": "public",
      "categories": [
        "Category 1",
        "Fixture"
      ],
      "channel": "Conformance Fixture",
      "channel_id": "fixture-channel",
      "comment_count": 787,
      "duration": 3599,
      "fixture_group": 1,
      "fixture_nullable": "g1",
      "formats": [
        {
          "format_id": "low-1",
          "height": 360,
          "width": 640
        },
        {
          "format_id": "high-1",
          "height": 720,
          "width": 1280
        }
      ],
      "id": "vid001",
      "is_live": false,
      "like_count": 6988,
      "live_status": null,
      "release_timestamp": 1788208200,
      "tags": [
        "topic-1",
        "group-1"
      ],
      "timestamp": 1788208200,
      "title": "Mars: New Dawn",
      "upload_date": "20260831",
      "uploader": "Conformance Fixture",
      "view_count": 1500000,
      "was_live": false,
      "webpage_url": "https://fixture.invalid/watch/vid001"
    },
    {
      "availability": "public",
      "categories": [
        "Category 2",
        "Fixture"
      ],
      "channel": "Conformance Fixture",
      "channel_id": "fixture-channel",
      "comment_count": 516,
      "duration": 3600,
      "fixture_group": 2,
      "fixture_nullable": "g2",
      "formats": [
        {
          "format_id": "low-2",
          "height": 360,
          "width": 640
        },
        {
          "format_id": "high-2",
          "height": 720,
          "width": 1280
        }
      ],
      "id": "vid002",
      "is_live": false,
      "like_count": 6092,
      "live_status": null,
      "release_timestamp": 1788164100,
      "tags": [],
      "timestamp": 1788164100,
      "title": "mars: new dawn",
      "upload_date": "20260831",
      "uploader": "Conformance Fixture",
      "view_count": 1500000,
      "was_live": false,
      "webpage_url": "https://fixture.invalid/watch/vid002"
    },
    {
      "availability": "public",
      "categories": [
        "Category 3",
        "Fixture"
      ],
      "channel": "Conformance Fixture",
      "channel_id": "fixture-channel",
      "comment_count": 47,
      "duration": 3601,
      "fixture_group": 3,
      "fixture_nullable": "g0",
      "formats": [],
      "id": "vid003",
      "is_live": false,
      "like_count": 7392,
      "live_status": null,
      "release_timestamp": 1788109200,
      "tags": [
        "topic-3",
        "group-0"
      ],
      "timestamp": 1788109200,
      "title": "Venus Weather",
      "upload_date": "20260830",
      "uploader": "Conformance Fixture",
      "view_count": 250000,
      "was_live": false,
      "webpage_url": "https://fixture.invalid/watch/vid003"
    },
    {
      "availability": "public",
      "categories": [
        "Category 0",
        "Fixture"
      ],
      "channel": "Conformance Fixture",
      "channel_id": "fixture-channel",
      "comment_count": 830,
      "duration": 900,
      "fixture_group": 0,
      "fixture_nullable": "g1",
      "formats": [
        {
          "format_id": "low-4",
          "height": 360,
          "width": 640
        },
        {
          "format_id": "high-4",
          "height": 720,
          "width": 1280
        }
      ],
      "id": "vid004",
      "is_live": false,
      "like_count": 3876,
      "live_status": "was_live",
      "release_timestamp": 1788080400,
      "tags": [
        "topic-4",
        "group-1"
      ],
      "timestamp": 1788080400,
      "title": "Mars [LIVE]",
      "upload_date": "20260830",
      "uploader": "Conformance Fixture",
      "view_count": 2000000,
      "was_live": true,
      "webpage_url": "https://fixture.invalid/watch/vid004"
    },
    {
      "availability": "public",
      "categories": [
        "Category 1",
        "Fixture"
      ],
      "channel": "Conformance Fixture",
      "channel_id": "fixture-channel",
      "comment_count": 1146,
      "duration": 0,
      "fixture_group": 1,
      "fixture_nullable": null,
      "formats": [
        {
          "format_id": "low-5",
          "height": 360,
          "width": 640
        },
        {
          "format_id": "high-5",
          "height": 720,
          "width": 1280
        }
      ],
      "id": "vid005",
      "is_live": false,
      "like_count": 1248,
      "live_status": null,
      "release_timestamp": 1788004800,
      "tags": [
        "topic-0",
        "group-2"
      ],
      "timestamp": 1788004800,
      "title": "Jupiter Update",
      "upload_date": "20260829",
      "uploader": "Conformance Fixture",
      "view_count": 0,
      "was_live": false,
      "webpage_url": "https://fixture.invalid/watch/vid005"
    },
    {
      "availability": "public",
      "categories": [
        "Category 2",
        "Fixture"
      ],
      "channel": "Conformance Fixture",
      "channel_id": "fixture-channel",
      "comment_count": null,
      "duration": null,
      "fixture_group": 2,
      "fixture_nullable": "g0",
      "formats": [
        {
          "format_id": "low-6",
          "height": 360,
          "width": 640
        },
        {
          "format_id": "high-6",
          "height": null,
          "width": 1280
        }
      ],
      "id": "vid006",
      "is_live": false,
      "like_count": null,
      "live_status": null,
      "release_timestamp": null,
      "tags": [
        "topic-1",
        "group-0"
      ],
      "timestamp": null,
      "title": "Untitled?",
      "upload_date": "20260828",
      "uploader": "Conformance Fixture",
      "view_count": null,
      "was_live": false,
      "webpage_url": "https://fixture.invalid/watch/vid006"
    },
    {
      "availability": "public",
      "categories": [
        "Category 3",
        "Fixture"
      ],
      "channel": "Conformance Fixture",
      "channel_id": "fixture-channel",
      "comment_count": 1032,
      "duration": 600,
      "fixture_group": 3,
      "fixture_nullable": "g1",
      "formats": [
        {
          "format_id": "low-7",
          "height": 360,
          "width": 640
        },
        {
          "format_id": "high-7",
          "height": 720,
          "width": 1280
        }
      ],
      "id": "vid007",
      "is_live": false,
      "like_count": 5516,
      "live_status": null,
      "release_timestamp": 1787875199,
      "tags": [
        "topic-2",
        "skip",
        "group-1"
      ],
      "timestamp": 1787875199,
      "title": "MARS geology",
      "upload_date": "20260827",
      "uploader": "Conformance Fixture",
      "view_count": 999999,
      "was_live": false,
      "webpage_url": "https://fixture.invalid/watch/vid007"
    },
    {
      "availability": "public",
      "categories": [
        "Category 0",
        "Fixture"
      ],
      "channel": "Conformance Fixture",
      "channel_id": "fixture-channel",
      "comment_count": 825,
      "duration": 600,
      "fixture_group": 0,
      "fixture_nullable": "g2",
      "formats": [
        {
          "format_id": "low-8",
          "height": 360,
          "width": 640
        },
        {
          "format_id": "high-8",
          "height": 720,
          "width": 1280
        }
      ],
      "id": "vid008",
      "is_live": false,
      "like_count": 7688,
      "live_status": null,
      "release_timestamp": 1787788801,
      "tags": [
        "topic-3",
        "raw-8-a",
        "group-2"
      ],
      "timestamp": 1787788801,
      "title": "Moon & Mars",
      "upload_date": "20260827",
      "uploader": "Conformance Fixture",
      "view_count": 1000000,
      "was_live": false,
      "webpage_url": "https://fixture.invalid/watch/vid008"
    },
    {
      "availability": "public",
      "categories": [
        "Category 1",
        "Fixture"
      ],
      "channel": "Conformance Fixture",
      "channel_id": "fixture-channel",
      "comment_count": 724,
      "duration": 1200,
      "fixture_group": 1,
      "fixture_nullable": "g0",
      "formats": [
        {
          "format_id": "low-9",
          "height": 360,
          "width": 640
        },
        {
          "format_id": "high-9",
          "height": 720,
          "width": 1280
        }
      ],
      "id": "vid009",
      "is_live": false,
      "like_count": 1769,
      "live_status": null,
      "release_timestamp": 1787767200,
      "tags": [
        "topic-4",
        null,
        "group-0"
      ],
      "timestamp": 1787767200,
      "title": "Duplicate",
      "upload_date": "20260826",
      "uploader": "Conformance Fixture",
      "view_count": 42,
      "was_live": false,
      "webpage_url": "https://fixture.invalid/watch/vid009"
    },
    {
      "availability": "public",
      "categories": [
        "Category 2",
        "Fixture"
      ],
      "channel": "Conformance Fixture",
      "channel_id": "fixture-channel",
      "comment_count": 248,
      "duration": 1200,
      "fixture_group": 2,
      "fixture_nullable": null,
      "formats": [
        {
          "format_id": "low-10",
          "height": 360,
          "width": 640
        },
        {
          "format_id": "high-10",
          "height": 720,
          "width": 1280
        }
      ],
      "id": "vid010",
      "is_live": false,
      "like_count": 4223,
      "live_status": null,
      "release_timestamp": 1787724000,
      "tags": null,
      "timestamp": 1787724000,
      "title": "Duplicate",
      "upload_date": "20260826",
      "uploader": "Conformance Fixture",
      "view_count": 42,
      "was_live": false,
      "webpage_url": "https://fixture.invalid/watch/vid010"
    },
    {